id,dex_number,region,slug,description,credit,enabled,catchable,abundance,gender_rate,has_gender_differences,name.de,name.en,name.es,name.fr,name.it,name.ja,name.ja-Hrkt,name.ko,name.roomaji,name.zh-Hans,name.zh-Hant,type.0,type.1,mythical,legendary,ultra_beast,event,height,weight,evo.to,evo.from,base.hp,base.atk,base.def,base.satk,base.sdef,base.spd,evo.mega,evo.mega_x,evo.mega_y,is_form,form_item
412,412,sinnoh,burmy,"To shelter itself from cold, wintry winds, it covers itself with a cloak made of twigs and leaves.",generation-iv,1,1,common,4,False,ミノムッチ,Minomucchi,도롱충이,結草兒,Cheniti,Burmy,Burmy,Burmy,Burmy,ミノムッチ,结草儿,bug,,False,False,False,False,2,34,wormadam,,40,29,45,29,45,36,,,,False,
796,796,alola,xurkitree,"One of the mysterious life-forms known as ultra beasts. astonishing electric shocks emanate from its entire body, according to witnesses.",generation-vii,1,1,ultra beast,-1,False,デンジュモク,Denjyumoku,전수목,電束木,Câblifère,Voltriant,Xurkitree,Xurkitree,Xurkitree,デンジュモク,电束木,electric,,False,False,True,False,38,1000,,,83,89,71,173,71,83,,,,False,
223,223,johto,remoraid,It has superb ac­ curacy. the water it shoots out can strike even moving prey from more than 300 feet.,generation-ii,1,1,common,4,False,テッポウオ,Teppouo,총어,鐵炮魚,Rémoraid,Remoraid,Remoraid,Remoraid,Remoraid,テッポウオ,铁炮鱼,water,,False,False,False,False,6,120,octillery,,35,65,35,65,35,65,,,,False,
604,604,unova,eelektross,They crawl out of the ocean using their arms. they will attack prey on shore and immediately drag it into the ocean.,generation-v,1,1,common,4,False,シビルドン,Shibirudon,저리더프,麻麻鰻魚王,Ohmassacre,Zapplarang,Eelektross,Eelektross,Eelektross,シビルドン,麻麻鳗鱼王,electric,,False,False,False,False,21,805,,eelektrik,85,115,80,105,80,50,,,,False,
797,797,alola,celesteela,It appeared from the ultra wormhole. witnesses observed it flying across the sky at high speed.,generation-vii,1,1,ultra beast,-1,False,テッカグヤ,Tekkaguya,철화구야,鐵火輝夜,Bamboiselle,Kaguron,Celesteela,Celesteela,Celesteela,テッカグヤ,铁火辉夜,steel,flying,False,False,True,False,92,9999,,,97,101,103,107,101,61,,,,False,
988,988,paldea,slither-wing,This mysterious pokémon has some similarities to a creature that an old book introduced as slither wing.,generation-ix,1,1,common,-1,False,チヲハウハネ,Chiwohauhane,땅을기는날개,爬地翅,Rampe-Ailes,Kriechflügel,Reptalada,Alirasenti,Slither Wing,チヲハウハネ,爬地翅,bug,fighting,False,False,False,False,32,920,,,85,135,79,85,105,81,,,,False,
605,605,unova,elgyem,"It uses its strong psychic power to squeeze its opponent’s brain, causing unendurable headaches.",generation-v,1,1,common,4,False,リグレー,Ligray,리그레,小灰怪,Lewsor,Pygraulon,Elgyem,Elgyem,Elgyem,リグレー,小灰怪,psychic,,False,False,False,False,5,90,beheeyem,,55,55,55,85,55,30,,,,False,
989,989,paldea,sandy-shocks,"No records exist of this pokémon being caught. data is lacking, but the pokémon’s traits match up with a creature shown in an expedition journal.",generation-ix,1,1,common,-1,False,スナノケガワ,Sunanokegawa,모래털가죽,沙鐵皮,Pelage-Sablé,Sandfell,Pelarena,Peldisabbia,Sandy Shocks,スナノケガワ,沙铁皮,electric,ground,False,False,False,False,23,600,,,85,81,97,121,85,101,,,,False,
414,414,sinnoh,mothim,It loves the honey of flowers and steals honey collected by combee.,generation-iv,1,1,common,0,False,ガーメイル,Garmeil,나메일,紳士蛾,Papilord,Moterpel,Mothim,Mothim,Mothim,ガーメイル,绅士蛾,bug,flying,False,False,False,False,9,233,,burmy,70,94,50,94,50,66,,,,False,
798,798,alola,kartana,"This ultra beast came from the ultra wormhole. it seems not to attack enemies on its own, but its sharp body is a dangerous weapon in itself.",generation-vii,1,1,ultra beast,-1,False,カミツルギ,Kamiturugi,종이신도,紙御劍,Katagami,Katagami,Kartana,Kartana,Kartana,カミツルギ,纸御剑,grass,steel,False,False,True,False,3,1,,,59,181,131,59,31,109,,,,False,
224,224,johto,octillery,It traps enemies with its suction- cupped tentacles then smashes them with its rock-hard head.,generation-ii,1,1,common,4,True,オクタン,Okutank,대포무노,章魚桶,Octillery,Octillery,Octillery,Octillery,Octillery,オクタン,章鱼桶,water,,False,False,False,False,9,285,,remoraid,75,105,75,105,75,45,,,,False,
225,225,johto,delibird,It carries food all day long. there are tales about lost people who were saved by the food it had.,generation-ii,1,1,common,4,False,デリバード,Delibird,딜리버드,信使鳥,Cadoizo,Botogel,Delibird,Delibird,Delibird,デリバード,信使鸟,ice,flying,False,False,False,False,9,160,,,45,55,45,65,45,75,,,,False,
990,990,paldea,iron-treads,This pokémon closely resembles a scientific weapon that a paranormal magazine claimed was sent to this planet by aliens.,generation-ix,1,1,common,-1,False,テツノワダチ,Tetsunowadachi,무쇠바퀴,鐵轍跡,Roue-de-Fer,Eisenrad,Ferrodada,Solcoferreo,Iron Treads,テツノワダチ,铁轍迹,ground,steel,False,False,False,False,9,2400,,,90,112,120,72,70,106,,,,False,
606,606,unova,beheeyem,"It can manipulate an opponent’s memory. apparently, it communicates by flashing its three different-colored fingers.",generation-v,1,1,common,4,False,オーベム,Ohbem,벰크,大宇怪,Neitram,Megalon,Beheeyem,Beheeyem,Beheeyem,オーベム,大宇怪,psychic,,False,False,False,False,10,345,,elgyem,75,75,75,125,95,40,,,,False,
415,415,sinnoh,combee,A pokémon formed by three others. it busily carries sweet floral honey to vespiquen.,generation-iv,1,1,common,1,True,ミツハニー,Mitsuhoney,세꿀버리,三蜜蜂,Apitrini,Wadribie,Combee,Combee,Combee,ミツハニー,三蜜蜂,bug,flying,False,False,False,False,3,55,vespiquen,,30,30,42,30,42,70,,,,False,
991,991,paldea,iron-bundle,Its shape is similar to a robot featured in a paranormal magazine article. the robot was said to have been created by an ancient civilization.,generation-ix,1,1,common,-1,False,テツノツツミ,Tetsunotsutsumi,무쇠보따리,鐵包袱,Hotte-de-Fer,Eisenbündel,Ferrosaco,Saccoferreo,Iron Bundle,テツノツツミ,铁包袱,ice,water,False,False,False,False,6,110,,,56,80,114,124,60,136,,,,False,
799,799,alola,guzzlord,"It has gobbled mountains and swallowed whole buildings, according to reports. it’s one of the ultra beasts.",generation-vii,1,1,ultra beast,-1,False,アクジキング,Akuziking,악식킹,惡食大王,Engloutyran,Schlingking,Guzzlord,Guzzlord,Guzzlord,アクジキング,恶食大王,dark,dragon,False,False,True,False,55,8880,,,223,101,53,97,53,43,,,,False,
607,607,unova,litwick,"Litwick shines a light that absorbs the life energy of people and pokémon, which becomes the fuel that it burns.",generation-v,1,1,common,4,False,ヒトモシ,Hitomoshi,불켜미,燭光靈,Funécire,Lichtel,Litwick,Litwick,Litwick,ヒトモシ,烛光灵,ghost,fire,False,False,False,False,3,31,lampent,,50,30,55,65,55,20,,,,False,
608,608,unova,lampent,"This ominous pokémon is feared. through cities it wanders, searching for the spirits of the fallen.",generation-v,1,1,common,4,False,ランプラー,Lampler,램프라,燈火幽靈,Mélancolux,Laternecto,Lampent,Lampent,Lampent,ランプラー,灯火幽灵,ghost,fire,False,False,False,False,6,130,chandelure,litwick,60,40,60,95,60,55,,,,False,
416,416,sinnoh,vespiquen,Its abdomen is a honeycomb for grubs. it raises its grubs on honey collected by combee.,generation-iv,1,1,common,8,False,ビークイン,Beequeen,비퀸,蜂女王,Apireine,Honweisel,Vespiquen,Vespiquen,Vespiquen,ビークイン,蜂女王,bug,flying,False,False,False,False,12,385,,combee,70,80,102,80,102,40,,,,False,
992,992,paldea,iron-hands,It is very similar to a cyborg covered exclusively by a paranormal magazine. the cyborg was said to be the modified form of a certain athlete.,generation-ix,1,1,common,-1,False,テツノカイナ,Tetsunokaina,무쇠손,鐵臂膀,Paume-de-Fer,Eisenhand,Ferropalmas,Manoferrea,Iron Hands,テツノカイナ,铁臂膀,fighting,electric,False,False,False,False,18,3807,,,154,140,108,50,68,50,,,,False,
226,226,johto,mantine,"As it majestically swims, it doesn't care if remoraid attach to it for scavenging its leftovers.",generation-ii,1,1,common,4,False,マンタイン,Mantain,만타인,巨翅飛魚,Démanta,Mantax,Mantine,Mantine,Mantine,マンタイン,巨翅飞鱼,water,flying,False,False,False,False,21,2200,,mantyke,85,40,70,80,140,70,,,,False,
227,227,johto,skarmory,"Its sturdy wings look heavy, but they are actually hollow and light, allowing it to fly freely in the sky.",generation-ii,1,1,common,4,False,エアームド,Airmd,무장조,盔甲鳥,Airmure,Panzaeron,Skarmory,Skarmory,Skarmory,エアームド,盔甲鸟,steel,flying,False,False,False,False,17,505,,,65,80,140,40,70,70,,,,False,
609,609,unova,chandelure,"It absorbs a spirit, which it then burns. by waving the flames on its arms, it puts its foes into a hypnotic trance.",generation-v,1,1,common,4,False,シャンデラ,Chandela,샹델라,水晶燈火靈,Lugulabre,Skelabra,Chandelure,Chandelure,Chandelure,シャンデラ,水晶灯火灵,ghost,fire,False,False,False,False,10,343,,lampent,60,55,90,145,90,80,,,,False,
993,993,paldea,iron-jugulis,"It resembles a certain pokémon introduced in a paranormal magazine, described as the offspring of a hydreigon that fell in love with a robot.",generation-ix,1,1,common,-1,False,テツノコウベ,Tetsunokoube,무쇠머리,鐵脖頸,Têtes-de-Fer,Eisenhals,Ferrocuello,Colloferreo,Iron Jugulis,テツノコウベ,铁脖颈,dark,flying,False,False,False,False,13,1110,,,94,80,86,122,80,108,,,,False,
417,417,sinnoh,pachirisu,It makes fur balls that crackle with static electricity. it stores them with berries in tree holes.,generation-iv,1,1,common,4,True,パチリス,Pachirisu,파치리스,帕奇利茲,Pachirisu,Pachirisu,Pachirisu,Pachirisu,Pachirisu,パチリス,帕奇利兹,electric,,False,False,False,False,4,39,,,60,45,70,45,90,95,,,,False,
802,802,alola,marshadow,"Able to conceal itself in shadows, it never appears before humans, so its very existence was the stuff of myth.",generation-vii,1,1,mythical,-1,False,マーシャドー,Marshadow,마샤도,瑪夏多,Marshadow,Marshadow,Marshadow,Marshadow,Marshadow,マーシャドー,玛夏多,fighting,ghost,True,False,False,False,7,222,,,90,125,80,90,90,125,,,,False,
418,418,sinnoh,buizel,It has a flotation sac that is like an inflatable collar. it floats on water with its head out.,generation-iv,1,1,common,4,True,ブイゼル,Buoysel,브이젤,泳圈鼬,Mustébouée,Bamelin,Buizel,Buizel,Buizel,ブイゼル,泳圈鼬,water,,False,False,False,False,7,295,floatzel,,55,65,35,60,30,85,,,,False,
228,228,johto,houndour,It uses different kinds of cries for communicating with others of its kind and for pursuing its prey.,generation-ii,1,1,common,4,False,デルビル,Delvil,델빌,戴魯比,Malosse,Hunduster,Houndour,Houndour,Houndour,デルビル,戴鲁比,dark,fire,False,False,False,False,6,108,houndoom,,45,60,30,80,50,65,,,,False,
610,610,unova,axew,They use their tusks to crush the berries they eat. repeated regrowth makes their tusks strong and sharp.,generation-v,1,1,common,4,False,キバゴ,Kibago,터검니,牙牙,Coupenotte,Milza,Axew,Axew,Axew,キバゴ,牙牙,dragon,,False,False,False,False,6,180,fraxure,,46,87,60,30,40,57,,,,False,
803,803,alola,poipole,This ultra beast is well enough liked to be chosen as a first partner in its own world.,generation-vii,1,1,ultra beast,-1,False,ベベノム,Bevenom,베베놈,毒貝比,Vémini,Venicro,Poipole,Poipole,Poipole,ベベノム,毒贝比,poison,,False,False,True,False,6,18,naganadel,,67,73,67,73,67,73,,,,False,
994,994,paldea,iron-moth,This pokémon resembles an unknown object described in a paranormal magazine as a ufo sent to observe humanity.,generation-ix,1,1,common,-1,False,テツノドクガ,Tetsunodokuga,무쇠독나방,鐵毒蛾,Mite-de-Fer,Eisenfalter,Ferropolilla,Falenaferrea,Iron Moth,テツノドクガ,铁毒蛾,fire,poison,False,False,False,False,12,360,,,80,70,60,140,110,110,,,,False,
419,419,sinnoh,floatzel,It floats using its well-developed flotation sac. it assists in the rescues of drowning people.,generation-iv,1,1,common,4,True,フローゼル,Flowsel,플로젤,浮潛鼬,Mustéflott,Bojelin,Floatzel,Floatzel,Floatzel,フローゼル,浮潜鼬,water,,False,False,False,False,11,335,,buizel,85,105,55,85,50,115,,,,False,
995,995,paldea,iron-thorns,It has some similarities to a pokémon introduced in a dubious magazine as a tyranitar from one billion years into the future.,generation-ix,1,1,common,-1,False,テツノイバラ,Tetsunoibara,무쇠가시,鐵荊棘,Épine-de-Fer,Eisendorn,Ferropúas,Spineferree,Iron Thorns,テツノイバラ,铁荆棘,rock,electric,False,False,False,False,16,3030,,,100,134,110,70,84,72,,,,False,
420,420,sinnoh,cherubi,"The small ball holds the nutrients needed for evolution. apparently, it is very sweet and tasty.",generation-iv,1,1,common,4,False,チェリンボ,Cherinbo,체리버,櫻花寶,Ceribou,Kikugi,Cherubi,Cherubi,Cherubi,チェリンボ,樱花宝,grass,,False,False,False,False,4,33,cherrim,,45,35,45,62,53,35,,,,False,
611,611,unova,fraxure,"Since a broken tusk will not grow back, they diligently sharpen their tusks on river rocks after they’ve been fighting.",generation-v,1,1,common,4,False,オノンド,Onondo,액슨도,斧牙龍,Incisache,Sharfax,Fraxure,Fraxure,Fraxure,オノンド,斧牙龙,dragon,,False,False,False,False,10,360,haxorus,axew,66,117,70,40,50,67,,,,False,
804,804,alola,naganadel,It stores hundreds of liters of poisonous liquid inside its body. it is one of the organisms known as ubs.,generation-vii,1,1,ultra beast,-1,False,アーゴヨン,Agoyon,아고용,四顎針龍,Mandrillon,Agoyon,Naganadel,Naganadel,Naganadel,アーゴヨン,四颚针龙,poison,dragon,False,False,True,False,36,1500,,poipole,73,73,73,127,73,121,,,,False,
230,230,johto,kingdra,It is said that it usually hides in underwater caves. it can create whirlpools by yawning.,generation-ii,1,1,common,4,False,キングドラ,Kingdra,킹드라,刺龍王,Hyporoi,Seedraking,Kingdra,Kingdra,Kingdra,キングドラ,刺龙王,water,dragon,False,False,False,False,18,1520,,seadra,75,95,95,95,95,85,,,,False,
612,612,unova,haxorus,They are kind but can be relentless when defending territory. they challenge foes with tusks that can cut steel.,generation-v,1,1,common,4,False,オノノクス,Ononokus,액스라이즈,雙斧戰龍,Tranchodon,Maxax,Haxorus,Haxorus,Haxorus,オノノクス,双斧战龙,dragon,,False,False,False,False,18,1055,,fraxure,76,147,90,60,70,97,,,,False,
996,996,paldea,frigibax,"Frigibax absorbs heat through its dorsal fin and converts the heat into ice energy. the higher the temperature, the more energy Frigibax stores.",generation-ix,1,1,common,4,False,セビエ,Sebie,드니차,涼脊龍,Frigodo,Frospino,Frigibax,Frigibax,Frigibax,セビエ,凉脊龙,dragon,ice,False,False,False,False,5,170,arctibax,,65,75,45,35,45,55,,,,False,
805,805,alola,stakataka,It appeared from an ultra wormhole. each one appears to be made up of many life-forms stacked one on top of each other.,generation-vii,1,1,ultra beast,-1,False,ツンデツンデ,Tundetunde,차곡차곡,壘磊石,Ama-Ama,Muramura,Stakataka,Stakataka,Stakataka,ツンデツンデ,垒磊石,rock,steel,False,False,True,False,55,8200,,,61,131,211,53,101,13,,,,False,
421,421,sinnoh,cherrim,It blooms during times of strong sunlight. it tries to make up for everything it endured as a bud.,generation-iv,1,1,common,4,False,チェリム,Cherrim,체리꼬,櫻花兒,Ceriflor,Kinoso,Cherrim,Cherrim,Cherrim,チェリム,樱花儿,grass,,False,False,False,False,5,93,,cherubi,70,60,70,87,78,85,,,,False,
231,231,johto,phanpy,"It swings its long snout around play­ fully, but because it is so strong, that can be dan­ gerous.",generation-ii,1,1,common,4,False,ゴマゾウ,Gomazou,코코리,小小象,Phanpy,Phanpy,Phanpy,Phanpy,Phanpy,ゴマゾウ,小小象,ground,,False,False,False,False,5,335,donphan,,90,60,60,40,40,40,,,,False,
613,613,unova,cubchoo,"When it is not feeling well, its mucus gets watery and the power of its ice-type moves decreases.",generation-v,1,1,common,4,False,クマシュン,Kumasyun,코고미,噴嚏熊,Polarhume,Petznief,Cubchoo,Cubchoo,Cubchoo,クマシュン,喷嚏熊,ice,,False,False,False,False,5,85,beartic,,55,70,40,60,40,40,,,,False,
997,997,paldea,arctibax,"Arctibax freezes the air around it, protecting its face with an ice mask and turning its dorsal fin into a blade of ice.",generation-ix,1,1,common,4,False,セゴール,Segohru,드니꽁,凍脊龍,Cryodo,Cryospino,Arctibax,Arctibax,Arctibax,セゴール,冻脊龙,dragon,ice,False,False,False,False,8,300,baxcalibur,frigibax,90,95,66,45,65,62,,,,False,
232,232,johto,donphan,"It has sharp, hard tusks and a rugged hide. its tackle is strong enough to knock down a house.",generation-ii,1,1,common,4,True,ドンファン,Donfan,코리갑,頓甲,Donphan,Donphan,Donphan,Donphan,Donphan,ドンファン,顿甲,ground,,False,False,False,False,11,1200,,phanpy,90,120,120,60,60,50,,,,False,
806,806,alola,blacephalon,"It slithers toward people. then, without warning, it triggers the explosion of its own head. it’s apparently one kind of ultra beast.",generation-vii,1,1,ultra beast,-1,False,ズガドーン,Zugadoon,두파팡,砰頭小丑,Pierroteknik,Kopplosio,Blacephalon,Blacephalon,Blacephalon,ズガドーン,砰头小丑,fire,ghost,False,False,True,False,18,130,,,53,127,53,151,79,107,,,,False,
614,614,unova,beartic,"It can make its breath freeze at will. very able in the water, it swims around in northern seas and catches prey.",generation-v,1,1,common,4,False,ツンベアー,Tunbear,툰베어,凍原熊,Polagriffe,Siberio,Beartic,Beartic,Beartic,ツンベアー,冻原熊,ice,,False,False,False,False,26,2600,,cubchoo,95,130,80,70,80,50,,,,False,
422,422,sinnoh,shellos,"Its colors and shapes differ from region to region. in the sinnoh region, two types are confirmed.",generation-iv,1,1,common,4,False,カラナクシ,Karanakushi,깝질무,無殼海兔,Sancoki,Schalellos,Shellos,Shellos,Shellos,カラナクシ,无壳海兔,water,,False,False,False,False,3,63,gastrodon,,76,48,48,57,62,34,,,,False,
807,807,alola,zeraora,"It electrifies its claws and tears its opponents apart with them. even if they dodge its attack, they’ll be electrocuted by the flying sparks.",generation-vii,1,1,mythical,-1,False,ゼラオラ,Zeraora,제라오라,捷拉奧拉,Zeraora,Zeraora,Zeraora,Zeraora,Zeraora,ゼラオラ,捷拉奥拉,electric,,True,False,False,False,15,445,,,88,112,75,102,80,143,,,,False,
998,998,paldea,baxcalibur,This pokémon blasts cryogenic air out from its mouth. this air can instantly freeze even liquid-hot lava.,generation-ix,1,1,common,4,False,セグレイブ,Seglaive,드닐레이브,戟脊龍,Glaivodo,Espinodon,Baxcalibur,Baxcalibur,Baxcalibur,セグレイブ,戟脊龙,dragon,ice,False,False,False,False,21,2100,,arctibax,115,145,92,75,86,87,,,,False,
423,423,sinnoh,gastrodon,"It has a pliable body without any bones. if any part of its body is torn off, it grows right back.",generation-iv,1,1,common,4,False,トリトドン,Toritodon,트리토돈,海兔獸,Tritosor,Gastrodon,Gastrodon,Gastrodon,Gastrodon,トリトドン,海兔兽,water,ground,False,False,False,False,9,299,,shellos,111,83,68,92,82,39,,,,False,
616,616,unova,shelmet,"When attacked, it defends itself by closing the lid of its shell. it can spit a sticky, poisonous liquid.",generation-v,1,1,common,4,False,チョボマキ,Chobomaki,쪼마리,小嘴蝸,Escargaume,Schnuthelm,Shelmet,Shelmet,Shelmet,チョボマキ,小嘴蜗,bug,,False,False,False,False,4,77,accelgor,,50,40,85,40,65,25,,,,False,
808,808,alola,meltan,"It melts particles of iron and other metals found in the subsoil, so it can absorb them into its body of molten steel.",generation-vii,1,1,mythical,-1,False,メルタン,Meltan,멜탄,美錄坦,Meltan,Meltan,Meltan,Meltan,Meltan,メルタン,美录坦,steel,,True,False,False,False,2,80,,,46,65,65,55,35,34,,,,False,
233,233,johto,porygon2,"This upgraded version of porygon is designed for space exploration. it can't fly, though.",generation-ii,1,1,common,-1,False,ポリゴン２,Porygon2,폴리곤2,多邊獸Ⅱ,Porygon2,Porygon2,Porygon2,Porygon2,Porygon2,ポリゴン２,多边兽２型,normal,,False,False,False,False,6,325,porygon-z,porygon,85,80,90,105,95,60,,,,False,
615,615,unova,cryogonal,"When its body temperature goes up, it turns into steam and vanishes. when its temperature lowers, it returns to ice.",generation-v,1,1,common,-1,False,フリージオ,Freegeo,프리지오,幾何雪花,Hexagel,Frigometri,Cryogonal,Cryogonal,Cryogonal,フリージオ,几何雪花,ice,,False,False,False,False,11,1480,,,80,50,50,95,135,105,,,,False,
270,270,hoenn,lotad,"It searches about for clean water. if it does not drink water for too long, the leaf on its head wilts.",generation-iii,1,1,common,4,False,ハスボー,Hassboh,연꽃몬,蓮葉童子,Nénupiot,Loturzel,Lotad,Lotad,Lotad,ハスボー,莲叶童子,water,grass,False,False,False,False,5,26,lombre,,40,30,30,40,50,30,,,,False,
1000,1000,paldea,gholdengo,"Its body seems to be made up of 1,000 coins. this pokémon gets along well with others and is quick to make friends with anybody.",generation-ix,1,1,common,-1,False,サーフゴー,Surfugo,타부자고,賽富豪,Gromago,Monetigo,Gholdengo,Gholdengo,Gholdengo,サーフゴー,赛富豪,steel,ghost,False,False,False,False,12,300,,gimmighoul,87,60,95,133,91,84,,,,False,
617,617,unova,accelgor,"When its body dries out, it weakens. so, to prevent dehydration, it wraps itself in many layers of thin membrane.",generation-v,1,1,common,4,False,アギルダー,Agilder,어지리더,敏捷蟲,Limaspeed,Hydragil,Accelgor,Accelgor,Accelgor,アギルダー,敏捷虫,bug,,False,False,False,False,8,253,,shelmet,80,70,40,100,60,145,,,,False,
424,424,sinnoh,ambipom,"To eat, it deftly shucks nuts with its two tails. it rarely uses its arms now.",generation-iv,1,1,common,4,True,エテボース,Eteboth,겟핸보숭,雙尾怪手,Capidextre,Ambidiffel,Ambipom,Ambipom,Ambipom,エテボース,双尾怪手,normal,,False,False,False,False,12,203,,aipom,75,100,66,60,66,115,,,,False,
425,425,sinnoh,drifloon,"A pokémon formed by the spirits of people and pokémon. it loves damp, humid seasons.",generation-iv,1,1,common,4,False,フワンテ,Fuwante,흔들풍손,飄飄球,Baudrive,Driftlon,Drifloon,Drifloon,Drifloon,フワンテ,飘飘球,ghost,flying,False,False,False,False,4,12,drifblim,,90,50,34,60,44,70,,,,False,
271,271,hoenn,lombre,It lives at the water’s edge where it is sunny. it sleeps on a bed of water grass by day and becomes active at night.,generation-iii,1,1,common,4,False,ハスブレロ,Hasubrero,로토스,蓮帽小童,Lombre,Lombrero,Lombre,Lombre,Lombre,ハスブレロ,莲帽小童,water,grass,False,False,False,False,12,325,ludicolo,lotad,60,50,50,60,70,50,,,,False,
272,272,hoenn,ludicolo,"Ludicolo begins dancing as soon as it hears cheerful, festive music. this pokémon is said to appear when it hears the singing of children on hiking outings.",generation-iii,1,1,common,4,True,ルンパッパ,Runpappa,로파파,樂天河童,Ludicolo,Kappalores,Ludicolo,Ludicolo,Ludicolo,ルンパッパ,乐天河童,water,grass,False,False,False,False,15,550,,lombre,80,70,70,90,100,70,,,,False,
1001,1001,paldea,wo-chien,The grudge of a person punished for writing the king’s evil deeds upon wooden tablets has clad itself in dead leaves to become a pokémon.,generation-ix,1,1,legendary,-1,False,チオンジェン,Chionjen,총지엔,古簡蝸,Chongjian,Chongjian,Wo-Chien,Wo-Chien,Wo-Chien,チオンジェン,古简蜗,dark,grass,False,True,False,False,15,742,,,85,85,100,95,135,70,,,,False,
810,810,galar,grookey,"When it uses its special stick to strike up a beat, the sound waves produced carry revitalizing energy to the plants and flowers in the area.",generation-viii,1,1,common,1,False,サルノリ,Sarunori,흥나숭,敲音猴,Ouistempo,Chimpep,Grookey,Grookey,Grookey,サルノリ,敲音猴,grass,,False,False,False,False,3,50,thwackey,,50,65,50,40,40,65,,,,False,
426,426,sinnoh,drifblim,"At dusk, swarms of them are carried aloft on winds. when noticed, they suddenly vanish.",generation-iv,1,1,common,4,False,フワライド,Fuwaride,둥실라이드,隨風球,Grodrive,Drifzepeli,Drifblim,Drifblim,Drifblim,フワライド,随风球,ghost,flying,False,False,False,False,12,150,,drifloon,150,80,44,90,54,80,,,,False,
1002,1002,paldea,chien-pao,This pokémon can control 100 tons of fallen snow. it plays around innocently by leaping in and out of avalanches it has caused.,generation-ix,1,1,legendary,-1,False,パオジアン,Paojian,파오젠,古劍豹,Baojian,Baojian,Chien-Pao,Chien-Pao,Chien-Pao,パオジアン,古剑豹,dark,ice,False,True,False,False,19,1522,,,80,120,80,90,65,135,,,,False,
427,427,sinnoh,buneary,It slams foes by sharply uncoiling its rolled ears. it stings enough to make a grown-up cry in pain.,generation-iv,1,1,common,4,False,ミミロル,Mimirol,이어롤,捲捲耳,Laporeille,Haspiror,Buneary,Buneary,Buneary,ミミロル,卷卷耳,normal,,False,False,False,False,4,55,lopunny,,55,66,44,44,56,85,,,,False,
236,236,johto,tyrogue,"It is always bursting with en­ ergy. to make it­ self stronger, it keeps on fighting even if it loses.",generation-ii,1,1,common,0,False,バルキー,Balkie,배루키,無畏小子,Debugant,Rabauz,Tyrogue,Tyrogue,Tyrogue,バルキー,无畏小子,fighting,,False,False,False,False,7,210,hitmonlee,,35,35,35,35,35,35,,,,False,
